itemId,name,price,ratingScore,review,location,brandName,sellerName,image,categories,itemSoldCntShow,discount,cat_1,cat_2,cat_3,category
2400325458,"Ấm đun siêu tốc, Bình Đun Nước Siêu Tốc Thủy Tinh Cuckoo Dung Tích 2L, Công suất 1500W, Ấm Siêu Tốc Trong Suốt thuỷ tinh chống sốc nhiệt, có Đèn Led, Tự Ngắt Khi Sôi, Bình Siêu Tốc, Ấm Đun Nước, Ấm Siêu Tốc Mini",79000,4.8,272.0,Vietnam,No Brand,Gia Dụng HN Thông Minh,https://vn-live-01.slatic.net/p/cb4146dcf1352e93e9218e1dec88faff.png,"[4400, 4425, 6037, 4433]",826.0,0.2,4400,4425,6037,do_gia_dung
3070582579,Kẹp tóc giả thắt bím đuôi ngựa nối dài ngoặm tóc giả bện tết có kèm nơ lụa tua rua cho nữ thời trang Hàn Quốc,119000,5.0,2.0,Vietnam,No Brand,AnGi Home,https://sg-test-11.slatic.net/p/49814d00552751bcc001dfee1e6f55f4.jpg,"[4405, 4956, 4879, 4949, 4955]",8.0,0.33,4405,4956,4879,thoi_trang_nu
1332099233,Thảm Xốp XPE Phủ Silicone Gấp Gọn 1m8 x 2m (thảm mỏng 1 phân) In Hình 2 Mặt Chống Thấm Chống Va Đập An Toàn Cho Bé (màu ngẫu nhiên),140000,4.8,9.0,Vietnam,Siêu Thị Việt,SUPERMARKET QUỐC BẢO,https://vn-live-01.slatic.net/p/668a7535ebb08e1b8534f6e58f50fd60.jpg,"[10216, 10327, 10333]",50.0,0.38,10216,10327,10333,me_va_be
2521441826,ĐẦM ÔM PHỐI CỔ SƠ MI TRANG TRỌNG CÁ TÍNH DPSM9,69000,5.0,11.0,Vietnam,No Brand,ULZZANG STORE HCM,https://sg-test-11.slatic.net/p/8f5affe11d4c7a22538859c43e87a8c9.jpg,"[62540802, 6396]",270.0,0.08,62540802,6396,0,thoi_trang_nu
3232422207,Kaw Silver Crest Sc-1589 Multifunctional Blender Industrial Blender 2 Blenders 4500W Capacity,359000,3.6,5.0,Vietnam,No Brand,Đăng Quang Shop,https://sg-test-11.slatic.net/p/00ad551934374db372aa0edc583d14d3.jpg,"[4400, 4425, 6037, 4438]",14.0,0.0,4400,4425,6037,do_gia_dung
2959710235,Phấn phủ kiềm dầu chống nắng Maybelline New York Fit Me Matte+ Poreless Powder SPF32 PA+++ Thái Lan,164000,5.0,1.0,Vietnam,No Brand,Heath& Beauty,https://vn-live-01.slatic.net/p/66a73c45cfabd7b979407bd19b05b0ed.jpg,"[4405, 4611, 4612, 4627]",16.0,0.0,4405,4611,4612,my_pham
3288422044,Elevating Comfortable Men's Casual Shoes,348000,4.8,,Hong Kong,No Brand,Men Fashion Concept Store,https://filebroker-cdn.lazada.vn/kf/Sa295f25541284deda3203b3d8bd01f4fe.jpg,"[62541201, 6371]",24.0,0.35,62541201,6371,0,the_thao
2423057200,"Women's Wide-Leg High-Waist Trousers with Elastic Waistband to Hug the Waist, Flattering, Beautiful Office Fashion, Beautiful Thick Snow and Rain Fabric.",89000,4.9,974.0,Vietnam,No Brand,Xưởng May Song Anh,https://sg-test-11.slatic.net/p/db099deb6fa46a281bc4424f23c218c8.jpg,"[62540802, 62541005, 7954]",2600.0,0.55,62540802,62541005,7954,thoi_trang_nu
2312206914,Hàng Mỹ - Cực Mạnh - Viên uống R0cket 1h Tăng cường sinh lý Kéo dài thời gian và  Chống xuất tinh sớm- hộp 10 viên,180000,4.6,132.0,Vietnam,No Brand,nhathuocthanhvan.vn,https://vn-live-01.slatic.net/p/d890736884aa0b299f63f23e7d7aaa00.jpg,"[10100869, 4741, 6791, 2369]",564.0,0.28,10100869,4741,6791,thuc_pham
2025635952,"[Sẵn hàng-VNXK] Quần tây âu nam vải xịn co giãn chống xù chống nhăn ống côn phù hợp học sinh, sinh viên, công sở",129000,4.7,114.0,Vietnam,No Brand,XƯỞNG MAY SỈ HÀ NỘI,https://vn-live-01.slatic.net/p/81d6fd4a18e7fcc1398990f614802ff4.jpg,"[62541004, 62540403, 7991]",456.0,0.78,62541004,62540403,7991,thoi_trang_nam
3203459526,Snow Foam Spray Bottle for Cleaning Snoker Shoes 300ml Removes All Stains_Wholesale Price Bien Hoa,45000,4.9,,Vietnam,No Brand,GIÁ SỈ BIÊN HÒA,https://sg-test-11.slatic.net/p/a3fbfa26f036e6ee184cd8c7e6e5f470.jpg,"[62540402, 6259]",0.0,0.4,62540402,6259,0,cham_soc_suc_khoe
2428995587,"VITAMIN 3B Gold - B1,B6,B12- Lọ 100 viên nang mềm Vinaphar - Hỗ trợ cải thiện tình trạng thiếu hụt vitamin nhóm B",65000,5.0,16.0,Vietnam,Vinaphar,BaoChauPharma,https://vn-live-01.slatic.net/p/c31d47e71f9bac7edbdbc1351f901be6.jpg,"[10100869, 4741, 6791, 2375]",51.0,0.44,10100869,4741,6791,thuc_pham
1624985367,"Đèn Livestream size 26 30 36 45 cm và chân 2m1 Hỗ Trợ Chụp Ảnh Make up Trang Điểm quay tiktok, bán hàng",58000,4.8,206.0,Vietnam,No Brand,Toughened cases- Minh Vy,https://vn-live-01.slatic.net/p/dfd2af7d084498ce255119c101aa10c0.jpg,"[42062201, 4522, 15187]",1100.0,0.35,42062201,4522,15187,phu_kien_thoi_trang
3169062650,Elite Basketball Socks with Towelling Sole for Superior Grip and Comfort,30000,5.0,15.0,China,STAR FRUIT,STAR FRUIT MALL,https://sg-test-11.slatic.net/p/e4d5c30be4206a4e07db971b3eaf58f3.png,"[62540204, 7992]",64.0,0.5,62540204,7992,0,cham_soc_suc_khoe
1988711719,"2.2l super kettle, 2.2l super kettle-1 year warranty-fast kettle-all family safe, kettles Super fast water, Thai ultrasonic water, thermal water kettle, cheap am Sieu TOC, instant water boiler, kettle Power by air",100000,4.7,325.0,Vietnam,ZODAN,ZODAN Corporation,https://vn-live-01.slatic.net/p/43796c25b844696d0566a8f94122e4b1.jpg,"[4400, 4425, 6037, 4433]",1600.0,0.29,4400,4425,6037,dien_tu
2367568870,"M1 CA KIỂU I CA GIỮ NHIỆT DUY TÂN I Hàng VIỆT NAM CHẤT LƯỢNG CAO I Size 1lit, 1,5lit, 3 lít. Giữ nhiệt lâu, màu sắc hiện đại KHÔNG ĐỌNG SƯƠNG BÊN NGOÀI CA. Đồ gia dụng Nhà Bếp Dụng cụ pha chế Nguyên liệu Thực Phẩm",46000,4.7,,Vietnam,No Brand,Ms Đoàn Việt,https://sg-live-01.slatic.net/p/ab7e76bcbc6f7f90e7a2d949138073de.jpg,"[4400, 4425, 6037, 4433]",0.0,0.29,4400,4425,6037,do_gia_dung
453344855,Combo 10 Quần Lót Nam vải cotton lưng chữ Thái - CITYMEN,92500,4.9,1622.0,Vietnam,CITYMEN,CITYMEN,https://filebroker-cdn.lazada.vn/kf/S370be5809adf45dd9413b398502e33b5Y.jpg,"[62540204, 62541803, 62541202, 7996]",5500.0,0.14,62540204,62541803,62541202,thoi_trang_nam
2799633209,"kích mỏ, kích cựa Thái Lan. kích thích gà quá trình phát triển cựa, mỏ.",70000,4.8,,Vietnam,No Brand,DUNG AN 2,https://sg-test-11.slatic.net/p/55051bc3ada0cd589745ec4d8ed9da99.jpg,"[10100869, 4741, 6791, 2369]",0.0,0.0,10100869,4741,6791,thuc_pham
3221330707,Office Style Dress with Bow K77,170000,5.0,32.0,Vietnam,No Brand,XƯỞNG MAY QUẾ TRÂN,https://vn-live-01.slatic.net/p/77e749791518300193443e5d8da3ecb5.jpg,"[62540802, 62541801, 11164]",101.0,0.0,62540802,62541801,11164,thoi_trang_nu
2428655049,"[TEM CHÍNH HÃNG] Tinh Chất Thay Da Sinh Học Thế Hệ Mới Paula’s Choice 25% AHA + 2% BHA Exfoliant Peel 30ml - SHOP CHUYÊN CUNG CẤP CÁC SẢN PHẨM CHẤT LƯỢNG CAO, ĐƯỢC SĂN ĐÓN, ƯA CHUỘNG TRÊN THỊ TRƯỜNG, HÀNG CHUẨN ĐẢM BẢO XÀI THÍCH NGAY, MỜI KHÁCH YÊU ỦNG HỘ",1199900,4.8,,Vietnam,OEM,HELLO SUNSHINE - YÊU LÀN DA BẠN,https://sg-test-11.slatic.net/p/edb3c0811ba0da571066361c44fd0230.jpg,"[4405, 2277, 2290]",0.0,0.0,4405,2277,2290,my_pham
2704454544,"Ladomax Ha-816 Electric Kettle - Capacity: 1500W - Capacity: 2.0 Liters - Safety: Automatically Shuts Off When Boiling, Overheating",150000,4.7,,Vietnam,No Brand,MY HOUSE MK,https://vn-live-01.slatic.net/p/c4f4eaf3625feef04c185dc5495731ad.png,"[4400, 4425, 6037, 4433]",0.0,0.46,4400,4425,6037,dien_tu
2020449112,THẮT LƯNG NAM DA THẬT DÁNG TRƠN KHÓA TỰ ĐỘNG MÀU ĐEN,45000,4.9,1709.0,Vietnam,No Brand,phukienthachsanh,https://vn-live-01.slatic.net/p/3a79cedfec6798bf23c21d0d7dd87b60.jpg,"[8943, 7811, 7813]",6800.0,0.5,8943,7811,7813,thoi_trang_nam
3173874088,"Kính chắn bụi đi đường chất liệu nhựa cao cấp kiểu dáng màu sắc thời trang, an toàn KC1624",59000,5.0,1.0,Vietnam,Couspan,KirinTech Hardware,https://vn-live-01.slatic.net/p/3510b373e2733df4bec3695a99774fe2.jpg,"[4303, 12380, 13303, 13545]",8.0,0.34,4303,12380,13303,phu_kien_thoi_trang
2530727898,Đầm Cổ Tròn Ôm Body Thun Gân Sang Chảnh Xịn Mịn/ Đầm HotGirl / FREE Size &lt; 55kg,69000,4.9,55.0,Vietnam,No Brand,Xưởng_Sỉ_Lẻ_Thời_Trang,https://vn-live-01.slatic.net/p/35daecb72aa97b9171ca6bd18726e6ad.png,"[62540802, 6396]",248.0,0.54,62540802,6396,0,thoi_trang_nu
1257572145,[HCM]Ấm điện siêu tốc Rạng Đông 18 lít Model: RD-AST18ST1,230000,4.7,3.0,Vietnam,No Brand,anh đức sg,https://vn-live-01.slatic.net/p/35ab774961d5338d6c0f3a11c0ec02e3.jpg,"[4400, 4425, 6037, 4433]",8.0,0.0,4400,4425,6037,dien_tu
1294527698,ĐẦM XÒE DỰ TIỆC CAO CẤP PHỐI VIỀN BÈO THẮT NƠ SANG TRỌNG,99000,4.4,47.0,Vietnam,No Brand,GIA KHANG_SHOP,https://vn-live-01.slatic.net/p/3cc8706d3a32fe95d1076fa6f8a875f2.jpg,"[62540802, 6396]",255.0,0.5,62540802,6396,0,thoi_trang_nu
1533889853,đá me Thanh Bình 42k 900g,49000,4.7,,Vietnam,No Brand,XỊN 79,https://filebroker-cdn.lazada.vn/kf/S3017d24755b74979826cfee4ce2d6584a.jpg,"[8799, 10003011, 10003060, 10003303]",0.0,0.0,8799,10003011,10003060,me_va_be
2636412460,Màn Hình LCD Viewsonic VA2406-H (24 inch/Full HD/VA/75Hz/4ms) – Hàng Chính Hãng,2390000,4.7,,Vietnam,Viewsonic,An Phát Computer Cần Thơ Việt Nam,https://vn-live-01.slatic.net/p/cd60b7d1dfc27735571d88b672515632.jpg,"[4401, 4474]",0.0,0.0,4401,4474,0,me_va_be
13354785755,LINSBAYWU CuộN đóng Thế Máy bay điều khiển từ xa Xốp EPP 2.4GHz Không thấm nước Máy bay RC xốp Sáng Tạo Chống va đập Máy bay chiến đấu điều khiển từ xa mát mẻ Quà Tặng bé trai,545000,4.7,,China,No Brand,linsbaywu,https://sg-test-11.slatic.net/p/69dd174e3c4b83cb186cfa80e9a03283.jpg,"[10216, 10223, 10268, 10269]",0.0,0.43,10216,10223,10268,me_va_be
3088782358,"Osaka Multi-Function Blender with Copper Lid, Grinds Ice, Blends Smoothies, Grinds Meat, Grinds All Kinds of Food, Compact, Convenient..",190000,5.0,1.0,Vietnam,No Brand,Kimphung_Houseware,https://vn-test-11.slatic.net/p/788d3cc9984184a125f2a1f8c537c24a.jpg,"[4400, 4425, 6037, 4438]",0.0,0.5,4400,4425,6037,do_gia_dung
797416621,Double Layer Electric Kettle / Kettle Electric Kettle 2L,110000,4.7,,Vietnam,No Brand,GIA DỤNG NHÀ LOAN,https://vn-live-01.slatic.net/p/5c985001ccb340328dcbe1a94bc4cbe9.jpg,"[4400, 4425, 6037, 4433]",0.0,0.0,4400,4425,6037,dien_tu
2358804888,[HCM]Chì kẻ mày phẩy sợi Tint My 4D-Tip Brow,19000,4.8,,Vietnam,No Brand,Landnn,https://vn-live-01.slatic.net/p/1d08fbceed363953052bd6085375e1ed.jpg,"[4405, 4611, 4654, 4660]",0.0,0.0,4405,4611,4654,my_pham
13343904259,Nike Air Jordan Dub Zero Black Taxi Gs Sports Shoes - Dv1360-017 |   Genuine,3141361,4.8,,China,Nike,clutch supply,https://sg-test-11.slatic.net/p/394bfd663e6bf11d9584aba44df5ed97.png,"[62188201, 1785, 62540406, 1786]",0.0,0.0,62188201,1785,62540406,the_thao
3323605968,"JIASHI Fluffy Winter Ear Muffs for Women and Men, Warm Anti-Wind Ear Protection, Soft Faux Fur Design, Perfect for Outdoor Riding and Cold Weather",38000,4.9,,China,JIASHI,JIASHI Shopping Mall,https://sg-test-11.slatic.net/p/99f2b65add9ca95b93e0e7f14211da70.png,"[62188201, 62541009, 62544801, 1720]",0.0,0.47,62188201,62541009,62544801,phu_kien_thoi_trang
2352217939,Viên Sủi Xtra Man Tăng Cường Sinh Lý Nam Giới 1 HỘP 20 VIÊN-giảm yếu sinh lý xuất tinh sớm AZDOCTOR,120000,5.0,3.0,Vietnam,No Brand,Nhà thuốc kim chi,https://filebroker-cdn.lazada.vn/kf/S2b2dbfde82824d5785360a47b278a313N.jpg,"[10100869, 4741, 6791, 2369]",26.0,0.5,10100869,4741,6791,thuc_pham
2494602326,"Jibbitz, Sticker, Charm 3D chủ đề cá môi dày lớn DIY Mayto nhựa cứng gắn Dép Crocs, Cross, Dép Sục, Cá Sấu JB-75",18000,5.0,17.0,Vietnam,No Brand,Mayto,https://vn-live-01.slatic.net/p/f3426c6b1561fa3c6837d886f8ffe9a2.png,"[62540402, 6259]",53.0,0.28,62540402,6259,0,cham_soc_suc_khoe
167995060,"Bộ 4 tấm Thảm xốp cho bé, thảm chơi lót trải sàn chống trơn trượt va đập kèm quà tặng – 60x60cm – hình thú disney – EcoBaby",163900,4.9,73.0,Vietnam,ecobaby,Five Little Ducks,https://vn-live-01.slatic.net/p/a393979f0267159b6dfd37247490477b.jpg,"[10216, 10327, 10333]",382.0,0.42,10216,10327,10333,me_va_be
245997976,100ml Dầu Hạnh Nhân PHÁP_Almond Oil_nguyên liệu làm mỹ phẩm handmade,55000,4.9,70.0,Vietnam,No Brand,Chai lọ hũ mỹ phẩ,https://vn-live-01.slatic.net/original/c3b21ec726579a8682d204ed23d1d413.jpg,"[4405, 4611, 4637, 4640]",438.0,0.08,4405,4611,4637,my_pham
3139183125,"(Trắng) Tinh chất HÀU BIỂN ROX TRẮNG 30V bổ sung kẽm, tăng cường sinh lý nam, giảm xuất sớm",69000,5.0,37.0,Vietnam,ROXTECH,DP Quốc Tế Thành Tâm,https://vn-live-01.slatic.net/p/9ae9824d4fc8b8b062175211b708ca20.jpg,"[10100869, 4741, 6791, 2369]",127.0,0.31,10100869,4741,6791,thuc_pham
2160711645,Hanlu New quick release buckle tactical nylon belt tooling outdoor training pants with casual men's belt,157000,5.0,131.0,China,Hanlu,Hanlu Style,https://my-live-02.slatic.net/p/0acab6d7efb179f69940e1586bc5660c.jpg,"[8943, 7811, 7813]",76.0,0.55,8943,7811,7813,thoi_trang_nam
2944305576,"mẫu mới Centrum Silver 325 viên từ Mỹ  mẫu mới- Vitamin tổng hợp cho cả Nam và Nữ trên 50 tuổi - SẢN PHẨM CHẤT LƯỢNG CAO, ĐƯỢC YÊU THÍCH SĂN ĐÓN TRÊN THỊ TRƯỜNG HIỆN NAY, HÀNG ĐẢM BẢO DÙNG SIÊU THÍCH MỜI KHÁCH YÊU TRẢI NGHIỆM",849900,2.0,1.0,Vietnam,OEM,TUẤN PHONG CLINIC BEAUTY,https://sg-test-11.slatic.net/p/8feb61ba8794059f36e62427008acbf8.jpg,"[10100869, 4741, 6791, 2375]",0.0,0.0,10100869,4741,6791,my_pham
3107563940,Cuckoo St16 Glass Kettle 1500W Capacity - Features between Kettle and Auto-Off When Boiling,115000,5.0,14.0,Vietnam,No Brand,Shop Hàng Xịn 2024,https://vn-live-01.slatic.net/p/eb262a685adb2d3bfeefbbdd306e5121.jpg,"[4400, 4425, 6037, 4433]",130.0,0.43,4400,4425,6037,do_gia_dung
3068859335,Rocket hỗ trợ sinh lý nam mạnh mẽ dẻo dai,110000,4.3,3.0,Vietnam,No Brand,Dược - Mỹ phẩm chính hãng Sale,https://vn-live-01.slatic.net/p/3e5ddf8bc8290ee5a47cf4e51ef58049.jpg,"[10100869, 4741, 6791, 2369]",13.0,0.0,10100869,4741,6791,thuc_pham
2991868030,Dép Sục Cross nam nữ unisex 2 Sọc cao cấp nhựa eva đi siêu êm nhẹ thời trang SUK2VACH,69000,5.0,2.0,Vietnam,No Brand,Maxlove Store,https://sg-test-11.slatic.net/p/53631bb120afe405ecf2fd265b83f989.jpg,"[62540402, 6246, 6248]",11.0,0.14,62540402,6246,6248,cham_soc_suc_khoe
3222393830,Sports Clothing for Men and Women 30-120kg - Active Printed Sportswear Set with 4-Way Stretch for Running and Gym Workouts. Code D26,99999,5.0,3.0,Vietnam,No Brand,minmouse01,https://vn-live-01.slatic.net/p/50b31ed1fe78709a9a2c8520e243ab03.jpg,"[42062401, 7527, 7545]",18.0,0.09,42062401,7527,7545,the_thao
2506163965,Khăn đa zi năng chống chói thời thượng - Du Lịch Đi mô tô Vải siêu mềm cứng cáp - Màu Trơn nhiều màu sắc Giao màu ngẫu n,6050,4.9,,Vietnam,No Brand,bekeo21,https://sg-test-11.slatic.net/p/0e5073ca7f49dee9ed3b0fb8ce88edfc.jpg,"[62188201, 62541009, 62544801, 1720]",0.0,0.0,62188201,62541009,62544801,phu_kien_thoi_trang
2523386476,"Phụ kiện kẹp tóc , buộc tóc nơ xinh xắn , dành hco nữ , đủ màu sắc , trẻ trung , công chúa",6500,4.9,1226.0,Vietnam,No Brand,OkSUfr.Selection,https://filebroker-cdn.lazada.sg/kf/Sb56eb2eb6e6c4cd79fd85e3c55a15e821.jpg,"[62188201, 62541009, 10858, 10861]",6600.0,0.38,62188201,62541009,10858,phu_kien_thoi_trang
2562551185,"Quần Thể Thao Nam Thời Trang Thường Ngày 2023, Quần Jogger Tập Gym, Chất Liệu Polyester Trung Bình, Dài Đến Mắt Cá Chân, Có Khóa Kéo, Thích Hợp Cho Chạy Bộ Và Tập Luyện",171000,4.7,187.0,China,No Brand,Global Merch Park,https://filebroker-cdn.lazada.vn/kf/S336693c9bd4b400880c99e7b1ec4a3a8C.jpg,"[42062401, 7527, 7542]",186.0,0.23,42062401,7527,7542,the_thao
2607539627,"[BEST SELLER] 💯(Chính hãng) Combo 2 HỘP XANH HỒNG  Serum Dưỡng Mộc Mi Mày 3 ml Giúp Kích Mộc Lông Mày Dài Và RậmCombo dưỡng mi hồng xanh dài và dày, dưỡng mày feg  hiệu quả  sau 7 ngày sử dụng",244580,4.8,,Vietnam,No Brand,GIAN HÀNG GIẢM GIÁ 225.HCM,https://filebroker-cdn.lazada.vn/kf/S0a59a8cfc67f481b84d3207528a49b20Y.jpg,"[4405, 4611, 4654, 10003339]",0.0,0.0,4405,4611,4654,my_pham
398620200,"Mền tuyết cho bé 70cmx100cm mền nhẹ êm ái và rất mát mền giặt được, ko xù lông, không nhăn nheo, có rất nhiều hình dễ thương.",29000,4.7,1705.0,Vietnam,No Brand,Drap gối giá kho,https://filebroker-cdn.lazada.vn/kf/S219eaa8f59164f54b04d9230951e5ae4Z.jpg,"[12644, 12651, 12704]",10400.0,0.0,12644,12651,12704,me_va_be
2531160912,Túi Đeo Vai Nữ Đeo Chéo Dành Cho Học Sinh - Phụ Kiện Thường Ngày Thời Trang,24900,5.0,376.0,Vietnam,No Brand,d3odSmYq.Selection,https://vn-live-01.slatic.net/p/f51e0a2bed6fe7646b3e55c233279035.jpg,"[8943, 7811, 7816]",1400.0,0.35,8943,7811,7816,thoi_trang_nu
2521850104,(DATE MOI) Phở Cung Đình Gói 68g (Bò/Gà),13500,5.0,164.0,Vietnam,No Brand,Shop Ngọc Hân 88,https://sg-test-11.slatic.net/p/bf7922ff79163dd6c2a0d48753920f26.jpg,"[8799, 10003011, 14451, 14759]",1900.0,0.0,8799,10003011,14451,thuc_pham
2520985159,✅[100% Thảo dượᴄ]   Cà gai leo 200gr   -Tiệm Đông Nam y Dưỡng Sinh,350000,4.8,,Vietnam,No Brand,Tiệm Đông Nam Y dưỡng Sinh,https://sg-test-11.slatic.net/p/52dbf4e8a9d6eb8409eea6fee2a863c1.jpg,"[10100869, 4741, 6791, 2369]",0.0,0.0,10100869,4741,6791,thuc_pham
2444236956,"Máy Xay Đa Năng OSAKA Nhật Bản, Máy Xay Sinh Tố Các Loại Với Công Suất 350W Dung Tích 700ML",99000,1.0,1.0,Vietnam,No Brand,DOTI Plus,https://vn-live-01.slatic.net/p/4b2d1ebaded28bcef7cd313512d8c84b.png,"[4400, 4425, 6037, 4438]",8.0,0.45,4400,4425,6037,do_gia_dung
2148830505,"[GIÁ TỐT GIẢM THÊM 10%]Set 14 Jibbitz, Sticker, Charm 3D chủ đề sinh vật biển DIY nhựa cứng gắn Dép Crocs, Cross, Dép Sục, Cá Sấu MayTo",65000,4.9,27.0,Vietnam,No Brand,Mayto,https://vn-live-01.slatic.net/p/e19084c111d51243b943d3cc959a35a6.png,"[62540402, 6259]",116.0,0.57,62540402,6259,0,cham_soc_suc_khoe
238075776,Đèn ngủ Led - Điện Việt,15500,4.9,168.0,Vietnam,No Brand,Điện Việt,https://vn-live-01.slatic.net/p/39907642d00b3cf3988bd43159b7e397.jpg,"[10100083, 12681, 10100136, 62551802, 10100137]",829.0,0.23,10100083,12681,10100136,dien_tu
2819587123,"Khăn choàng cổ, khăn quàng cổ len dạ kẻ nam nữ phong cách Hàn Quốc",50000,5.0,16.0,Vietnam,No Brand,Clover Store 68,https://vn-live-01.slatic.net/p/6ceac3cbcd9c3cf0afe9f8e661d98758.jpg,"[8943, 7811, 7831]",58.0,0.5,8943,7811,7831,phu_kien_thoi_trang
2539720749,Bóng Golf Tổng Hợp 10 Bóng Mới 85-90%,70000,5.0,236.0,Vietnam,No Brand,C Golf 2hand,https://filebroker-cdn.lazada.vn/kf/S7b2b21e4bc0648fb992efc0bf5558a24F.jpg,"[1355, 6592, 11882, 11892]",1600.0,0.0,1355,6592,11882,cham_soc_suc_khoe
13343834553,Nike Air Air Jordan 4 Retro'Bred Reimagined' Gs Sneakers - Fq8213-006 |   Genuine,4214660,4.8,,China,Nike,clutch supply,https://sg-test-11.slatic.net/p/022f99b905e5b534d14baca755f75ba7.jpg,"[62188201, 1785, 62540406, 1786]",0.0,0.0,62188201,1785,62540406,the_thao
2725793092,Pijama tay dài cổ vuông bộ đồ ngủ nữ pijama tiểu thư dài tay mặc nhà thu đông CARY,39000,4.6,89.0,Vietnam,No Brand,CHILI đồ ngủ nữ,https://vn-live-01.slatic.net/p/f86afce86538de9cde120aecd3d40dee.jpg,"[62540204, 7985]",364.0,0.5,62540204,7985,0,thoi_trang_nu
1837454060,Canh rong biển thị gà ăn liền I-Soup 42g (túi 06 viên cho 06 khẩu phần ăn)- Viên Sấy Thăng Hoa công nghệ Nhật Bản,68000,4.9,546.0,Vietnam,I.Soup,NatureFoods,https://vn-live-01.slatic.net/p/0b660f2c260ac38ee90f3ca489384b62.png,"[8799, 10003011, 14451, 14761]",3500.0,0.0,8799,10003011,14451,thuc_pham
3230611031,"Bộ 10 Charm Sticker Dẻo Shinn Dâu Dùng Gắn Dép Cross, Dép Sục, Dép Xốp",45000,4.9,,Vietnam,No Brand,Chic Charm - Charm Sticker Gắn Dép,https://sg-test-11.slatic.net/p/62d093552a24b9f67943a18cc15481da.jpg,"[62540402, 6259]",0.0,0.0,62540402,6259,0,cham_soc_suc_khoe
13319716783,Dệt Kim Khăn choàng nhỏ khăn phụ nữ Hàn Quốc mặc bên ngoài thời trang và phong cách,64740,4.8,,China,Heabety,Heabety beauty,https://sg-test-11.slatic.net/p/abb4257b31c3ef92b492cbee576dd873.jpg,"[4404, 4498]",0.0,0.41,4404,4498,0,thoi_trang_nu
3114114962,Automatic Multi-Function Fruit Juicer - Orange Juicer,179000,4.3,6.0,Vietnam,No Brand,ĐỒ GIA DỤNG - ANTOAN - ĐA NGÀNH,https://vn-live-01.slatic.net/p/7bd3892fae372b303af5b938ce219a5d.jpg,"[4400, 4425, 6037, 4438]",25.0,0.0,4400,4425,6037,do_gia_dung
3208206373,"Ginseng Velvet Kidney Tonic for Men and Women - Supports Kidney Disease, Weak Kidneys |   Box of 60/30 Genuine Tablets",120000,5.0,2.0,Vietnam,Daison,nhà thuoc 24 h,https://vn-live-01.slatic.net/p/8d5adb4d571127ca0577dc224d83ec12.jpg,"[10100869, 4741, 6791, 2369]",11.0,0.4,10100869,4741,6791,thuc_pham
13329275460,Eshylala Dikalu ánh trăng trắng Highlighter Palette ánh sáng lung linh kim cương độ bóng cao làm sáng đường viền tự nhiên lâu dài khuôn mặt trang điểm mỹ phẩm,14616,4.8,,China,Eshylala,Eshylala Vietnam,https://sg-test-11.slatic.net/p/324589a08b51185e37292c6ba5dac69f.jpg,"[4405, 4611, 4612, 4634]",0.0,0.72,4405,4611,4612,my_pham
167994262,"Bộ 4 tấm Thảm xốp cho bé, thảm chơi lót trải sàn chống trơn trượt va đập kèm quà tặng – 60x60cm – hình siêu nhân – EcoBaby",163900,5.0,1.0,Vietnam,ecobaby,Five Little Ducks,https://vn-live-01.slatic.net/p/0fafeb11e811a97aa8973590f742f85a.jpg,"[10216, 10327, 10333]",11.0,0.41,10216,10327,10333,me_va_be
870328755,Viền Dán Cửa Xe Ô Tô Chống Va Đập Bảo Vệ Xế Yêu Độ Mút Cao Dài 5 Mét Lõi Kim Loại Cao Cấp,89000,4.7,,Vietnam,OEM,Bảo Hân Auto,https://vn-live-01.slatic.net/p/792c2c6504a457d226043fec3da272b9.jpg,"[4303, 8289, 8302, 8303]",0.0,0.26,4303,8289,8302,me_va_be
2390227847,"Kính đổi màu khi ra nắng, gọng kính kim loại sang trọng, tròng kính chống tia UV bảo vệ mắt khi đi nắng",235000,4.9,,Vietnam,No Brand,Hong Ngoc Eyeware,https://vn-live-01.slatic.net/p/388bdfc77e050481beb0e91c10a81f8e.jpg,"[8943, 3504, 13326]",0.0,0.38,8943,3504,13326,phu_kien_thoi_trang
823704149,[ Hương vị tuổi thơ ] Combo 20 gói tăm cay ăn vặt siêu ngon,35000,4.7,31.0,Vietnam,No Brand,Đồ Ăn Vặt Sỉ Lẻ,https://vn-live-01.slatic.net/p/95d3ef4b66e432077d8af2a0939cc2c6.jpg,"[8799, 10003011, 10003059, 10003285]",228.0,0.5,8799,10003011,10003059,thuc_pham
2622058764,Kem nền - Kem Makeup thần thánh Thái lan,149000,4.8,,Vietnam,No Brand,Rubi_Cosmetic,https://vn-live-01.slatic.net/p/de0ea59bca1735472931fba394f51f81.jpg,"[4405, 4611, 4612, 7534]",7.0,0.25,4405,4611,4612,my_pham
3330686509,"Fashionable Protective Glasses, Windproof, Sandproof, Dustproof, and Waterdrop-Proof Protective Glasses for Men and Women",27500,4.9,,Vietnam,No Brand,Ruby Luxury,https://vn-live-01.slatic.net/p/c63f716c8555a93642cf221e1dcc0cfe.jpg,"[8943, 3504, 13326]",0.0,0.0,8943,3504,13326,phu_kien_thoi_trang
3205211173,Jibbitz Charm Crocs Outdoor Vacay 5 Pcs - 10008938,595000,4.9,,Vietnam,Crocs,Supersports,https://sg-test-11.slatic.net/p/0f186d5d3bacbeb1fcd918b5c95f7e00.jpg,"[62188201, 1785, 4176]",0.0,0.0,62188201,1785,4176,cham_soc_suc_khoe
3287567463,HuanQiu Women's Casual Sports Shoes Spring 2026 Fashionable Versatile Thick Bottom Heightening Leisure Sports Shoes Black Silver,497000,5.0,1.0,Hong Kong,No Brand,Women Fashion Concept Store,https://filebroker-cdn.lazada.vn/kf/Sff317b4ff6ac4ad58f38da49c9892831y.jpg,"[62540402, 7804]",50.0,0.34,62540402,7804,0,the_thao
13356435527,Nike | Velcro Breathable Low Top Sneakers,1327000,4.8,,China,Nike,fengchi sport specialty store,https://filebroker-cdn.lazada.vn/kf/S6886eb60cc2b47ccb6c25510abfb7799j.jpg,"[62188201, 1785, 62540406, 1786]",0.0,0.0,62188201,1785,62540406,the_thao
3244085680,adidas | Children's Breathable Lightweight Sneakers,697000,5.0,1.0,China,adidas,MY.JO sports shoes and clothing Specialty Store,https://filebroker-cdn.lazada.vn/kf/S5e87ab2c3e714bc686c8f3ee94b77d99q.jpg,"[62188201, 1785, 62540406, 1786]",6.0,0.0,62188201,1785,62540406,the_thao
2510757283,Kính Mát Vuông Unisex Thời Trang UV400 Bảo Vệ Toàn Viền Gọng Kim Loại Kính Mát Thời Trang Nam Nữ,9900,4.9,1029.0,Vietnam,PTQ,PTQVNshop,https://filebroker-cdn.lazada.sg/kf/Sd96cdd19c39b4a9f9150df6ffdb67913I.jpg,"[8943, 3504, 13326]",3200.0,0.4,8943,3504,13326,thoi_trang_nam
2396095280,"Ấm Siêu Tốc Đun Nước Cuckoo, Bình Nước Siêu Tốc Công Suất Sao 1500W Tự Ngắt Điện Khi Sôi, 2 Lớp Cách Nhiệt Chống Cháy Dung Tích 2.5L, Bảo Hành 12 Tháng",79000,4.8,355.0,Vietnam,No Brand,DOTI Plus,https://vn-live-01.slatic.net/p/17684bd124099b01dcfdacfa7eee2cdc.png,"[4400, 4425, 6037, 4433]",1200.0,0.2,4400,4425,6037,do_gia_dung
2472631610,Oppo A3S A5S A7 F9 A12 A1K A16K A17 A54 A57 A77 Case with Hello Kitty Stand and Mirror,40000,5.0,3.0,Vietnam,No Brand,Phukien thoitrang,https://filebroker-cdn.lazada.vn/kf/Scee0c56f74004588ba2e45939bb5b143n.jpg,"[42062201, 4522, 15182]",0.0,0.0,42062201,4522,15182,phu_kien_thoi_trang
2968234517,2L Glass Kettle L Transparent Electric Kettle L Tea Kettle Automatically Shuts Off When Boiling,109999,4.7,14.0,Vietnam,No Brand,ĐI CHỢ HỘ,https://vn-live-01.slatic.net/p/deaee4939d21cbb46bbec3058b8607c1.jpg,"[4400, 4425, 6037, 4433]",52.0,0.44,4400,4425,6037,do_gia_dung
3324589334,adidas | Shock Absorbing Comfortable Athletic Casual Shoes,796000,5.0,1.0,China,adidas,YiWang Genuine Goods,https://ae01.alicdn.com/kf/S982dae0395e14f6280103dc9b5ac2fae3.png,"[62188201, 1785, 62540406, 1786]",5.0,0.0,62188201,1785,62540406,the_thao
292130145,Special Combo of 2 Jars: Peanuts with Garlic and Chili - Coconut Jam 1kg Sk Food,130650,4.9,120.0,Vietnam,No Brand,SK FOOD,https://vn-live-01.slatic.net/p/8ee3d2c808d94b1bca264a16b8c2cea9.jpg,"[8799, 10003011, 10003060, 8869]",441.0,0.35,8799,10003011,10003060,thuc_pham
