itemId,name,price,ratingScore,review,location,brandName,sellerName,image,categories,itemSoldCntShow,discount,cat_1,cat_2,cat_3,category
3274193197,MaxgePC Trong suốt Silicone chống va chạm hạt tủ quần áo cửa chống va chạm Pad câm dán đệm chống trượt chống keo hạt,15626,4.7,,China,MaxgePC,MaxgePC Vietnam,https://sg-test-11.slatic.net/p/1f67a27ecc4e9cea3c931b39d6a013d7.jpg,"[12645, 12652, 62553203, 12724]",0.0,0.44,12645,12652,62553203,me_va_be
2472881544,Vương miện cô dâu nhiều mã,68000,5.0,15.0,Vietnam,No Brand,homezdecor,https://sg-test-11.slatic.net/p/6b1ddc1f1580b9528d6869be4cc709c5.jpg,"[8943, 7811, 7827]",67.0,0.0,8943,7811,7827,phu_kien_thoi_trang
3230122975,"SET 8 HOA ĐÍNH NGỌC LOẠI DẺO GẮN DÉP CROSS, DÉP SỤC, DÉP XỐP...đã gắn sẵn đế xài vào dép",65000,4.9,,Vietnam,No Brand,Chic Charm - Charm Sticker Gắn Dép,https://sg-test-11.slatic.net/p/cd59d5f81f629ad27801efd8fc2d026c.jpg,"[62540402, 6259]",0.0,0.0,62540402,6259,0,cham_soc_suc_khoe
2532967597,"Rây bằng thép không gỉ Nhà bếp gia đình với chủ đề móc, chiên dầu, lẩu lớn, lọc, muỗng",3300,5.0,8368.0,Vietnam,No Brand,li67817888,https://vn-live-01.slatic.net/p/0f13ca163630be1c5c0f85be9e0e973a.jpg,"[12648, 62551602, 12676, 12822]",35700.0,0.41,12648,62551602,12676,do_gia_dung
2597536640,"Ấm pha trà giữ nhiệt inox dung tích 1000L có lưới lọc, bình pha trà giữ nhiệt cao cấp giữ nhiêt cao cấp",87900,4.7,,Vietnam,No Brand,SỈ LẺ GIA DỤNG 966(Sơn Liễu),https://sg-test-11.slatic.net/p/2370b8fe79da5560628ea9c4f13f1f5d.jpg,"[4400, 4425, 6037, 4433]",0.0,0.04,4400,4425,6037,do_gia_dung
3029689766,"Set 60 màu ACRYLIC Marker ĐẦU NHỌN CHỐNG THẤM NƯỚC Không Vẽ Lên Đồ Vật Nhẵn, lau được khi dính lên da",55500,4.9,35.0,Vietnam,No Brand,Bum Bum House.Selection,https://vn-live-01.slatic.net/p/63306efb236c0f4acee3c46bbbd4ce97.png,"[12649, 12685, 12687, 12992]",166.0,0.23,12649,12685,12687,my_pham
2998335687,Phấn nước Ohui Hàn Quốc kèm lõi thay thế SPF 50 Nữ Trang Điểm Cosmetic Women Mỹ Phẩm,69000,5.0,1.0,Vietnam,No Brand,Kho sỉ cu kisd,https://sg-test-11.slatic.net/p/0bf5a613eaca892cbe660520b45670c5.jpg,"[4405, 4611, 4612, 4627]",0.0,0.31,4405,4611,4612,my_pham
3153349487,"Ấm Siêu Tốc Thủy Tinh CUCKOO 2.0L Cao Cấp Công Suất 1300W, Tự Ngắt Khi Sôi",120000,4.9,15.0,Vietnam,No Brand,International VIP Store,https://vn-live-01.slatic.net/p/47343862b81c0ecc51eecde35b30ecfb.jpg,"[4400, 4425, 6037, 4433]",82.0,0.4,4400,4425,6037,do_gia_dung
1689678769,"[HCM]Ván trượt thể thao dành cho trẻ em từ 2 tuổi trở lên,thiết kế chăc chắn, độ bền cao chống va đập,cân bằng an toàn. Ván Trượt Size 45cm - 60cm- 70cm -80cm",99000,4.5,158.0,Vietnam,No Brand,SHOP ĐỒ CHƠI TRẺ EM SIÊU RẺ,https://vn-live-01.slatic.net/p/8aba0e1a38ee77c952907d5b1c446d19.png,"[1355, 6593, 6988, 7220]",689.0,0.5,1355,6593,6988,me_va_be
2001491242,ÁO KHOÁT CHỐNG NẮNG NAM NỮ CAO CẤP 3 TRONG 1 TIỆN LỢI PHÙ HỢP VỚI MỌI LỨA TUỔI CÓ SIZE ĐẾN 100KG,109000,4.9,146.0,Vietnam,No Brand,HUỲNH PHẠM SHOP,https://vn-live-01.slatic.net/p/473bf9a8f8cdd9c2d7a1dca392191068.jpg,"[62540802, 62541801, 7975]",499.0,0.45,62540802,62541801,7975,thoi_trang_nu
2902767707,JULYHOT Ngọt Ngào Dễ Thương Nhỏ Hoa In Đàn Hồi Tóc Ban Nhạc Cho Phụ Nữ Cô Gái Thời Trang Ren Tóc Scrunchies Tóc Phụ Kiện Dễ Thương Mũ Nón,10858,4.9,,China,JULYHOT,JULYHOT VN,https://sg-test-11.slatic.net/p/547787b1b14d5242dad299938fba89dd.jpg,"[8943, 7811, 7827]",6.0,0.44,8943,7811,7827,phu_kien_thoi_trang
3196320722,JIFANPAUL | Versatile Summer Stiletto Heels Sandals,197000,4.8,14.0,China,JIFANPAUL,JIFANPAUL Global,https://filebroker-cdn.lazada.vn/kf/Sc0bf3994f9914b668aab9da624384c817.jpg,"[62540402, 6311, 11144]",23.0,0.11,62540402,6311,11144,thoi_trang_nu
2615787186,"Gel Ezanic 20% Azelaic Acid thâm đỏ, thâm nâu 15g",145000,5.0,6.0,Vietnam,No Brand,Chang.skincare,https://sg-test-11.slatic.net/p/17a251687dd8582d4fe9fd5713e4c298.jpg,"[4405, 2277, 2283]",110.0,0.09,4405,2277,2283,my_pham
2212081115,"Jibbitz sticker gấu nâu, mèo Kitty hai tông màu trắng và nâu chocolate gắn dép sục Crocs",3500,4.9,,Vietnam,No Brand,4con6,https://vn-live-01.slatic.net/p/fcca59997c6fc4bd86d5c0d8d2c977f1.jpg,"[62540402, 6259]",0.0,0.5,62540402,6259,0,cham_soc_suc_khoe
13333686248,adidas | Adidas Junior Gazelle Home Pangk Daily Lightweight Comfortable Fashion Sneakers,876150,4.8,,South Korea,adidas,The KoreaMart,https://filebroker-cdn.lazada.vn/kf/S326d0797bb1648679022391007410859x.png,"[62188201, 1785, 62540406, 1786]",0.0,0.54,62188201,1785,62540406,the_thao
295144566,Bộ thể thao nam họa tiết màu đẹp,98000,5.0,1.0,Vietnam,No Brand,Shop Thời trang nam Style,https://vn-live-01.slatic.net/p/103cfe60fbebb24d9469f6f7222aef39.jpg,"[42062401, 7527, 7545]",0.0,0.46,42062401,7527,7545,the_thao
2942889839,Ấm Đun Siêu Tốc Mini Jubilee Mart 3 Lớp Tay Cầm Cách Nhiệt Ấm Đun Nước Nhanh Sôi Tiết Kiệm Thời Gian,129000,4.0,4.0,Vietnam,Jubilee Mart,JubileeMart Store,https://vn-live-01.slatic.net/p/08f2e58f68a710ab7e3c6f71ac05b11e.png,"[4400, 4425, 6037, 4433]",13.0,0.5,4400,4425,6037,do_gia_dung
528620820,"[CAO CẤP]Ấm Siêu Sắc Thuoc Điện Tự Động Gốm Bát Tràng Full Cook (3,2 lít)ẤM SẮC THUOC BẮC 2 CHẾ ĐỘ - ẤM SIÊU TỐC 3.2 LÍT",249000,4.8,36.0,Vietnam,No Brand,DUY HẢI STORE,https://vn-live-01.slatic.net/p/9f932b89832df9ea770b1f9695fd0cfb.jpg,"[4400, 4425, 6037, 4433]",110.0,0.22,4400,4425,6037,dien_tu
1884585488,Himalayan Pink Salt Granules 1kg,52000,4.9,14.0,Vietnam,suc khoe xanh,Suckhoexanh.vn,https://vn-live-01.slatic.net/p/2768212c5f6f31a3dbe2781631fb11f3.png,"[8799, 10003011, 10003057, 10003306]",59.0,0.04,8799,10003011,10003057,cham_soc_suc_khoe
1867286380,Kich điện sin chuẩn 1000w 12v- 24V lên 220v .Inverter cao cấp,687250,5.0,1.0,Vietnam,No Brand,NHAT DUY COMPANY,https://sg-live-01.slatic.net/p/20282249f5e458e7bcb70cfb7e73d6ba.jpg,"[12646, 12662, 12909]",0.0,0.0,12646,12662,12909,dien_tu
2555951019,Giày Nam Chạy Bộ Mùa Hè Vải Lưới Thoáng Khí Nhẹ,95000,5.0,3.0,Vietnam,No Brand,HCM-Giày,https://sg-test-11.slatic.net/p/e638cba88e8f05aeb6a3452b321540c7.jpg,"[62541201, 6371]",0.0,0.0,62541201,6371,0,the_thao
2844004715,Bình đun siêu tốc 2.0lit hàng tốt kim cương,195000,4.7,,Vietnam,No Brand,Namisale,https://filebroker-cdn.lazada.vn/kf/S5d9910073b7f466a96dcfa1b62db679aA.jpg,"[4400, 4425, 6037, 4433]",0.0,0.22,4400,4425,6037,dien_tu
3057572017,"Jibbitz ngọc trai 3d cao cấp, charm gắn dép sục viên ngọc màu trắng, sticker 3d gắn dép sục",15000,4.9,,Vietnam,No Brand,Nhà Cá Sấu,https://sg-test-11.slatic.net/p/68eeec45757b9153490fe00e5bc392d0.jpg,"[62540402, 6259]",0.0,0.0,62540402,6259,0,cham_soc_suc_khoe
1106136168,Ấm Siêu Tốc Inox Sunhouse Happy Time Htd1055 (1.5L),140000,5.0,8.0,Vietnam,Happy time,GiaDungHCM 1610525427,https://vn-live-01.slatic.net/p/f67802056defee269df330becbc8b0a4.jpg,"[4400, 4425, 6037, 4433]",18.0,0.13,4400,4425,6037,do_gia_dung
13358071718,"Xiaomi Poco X8 Pro Phone (8+256Gb) |   8+512Gb |   12+512Gb) |   6.59"" 1.5K 120Hz Screen - 18 Month Warranty",9490000,4.7,,Vietnam,Xiaomi,Xiaomi undefined,https://vn-live-01.slatic.net/p/ac4d655d258bc84b9c34f625d116a9c9.jpg,"[4402, 4518]",0.0,0.4,4402,4518,0,dien_tu
3172006377,"(Mp-TH) Phấn nước L-Da Cushion BB chống nước, trắng mịn , cấp ẩm , che khuyết điểm",47000,5.0,3.0,Vietnam,No Brand,Shop MP Thái - Việt Thiên Hoa,https://sg-test-11.slatic.net/p/b251067cfa6fa13b77fd0ddfd4e63575.jpg,"[4405, 4611, 4612, 4627]",9.0,0.28,4405,4611,4612,my_pham
3130671921,[Finesse] Linen Straw Regency Bonnets Hats for Women Sun Hat Bow Beach Cap Large Wide Brim Cloche Hat Chapeau Femme Lace up Outdoor Summer,62130,4.8,28.0,China,No Brand,FashionFinessE,https://sg-test-11.slatic.net/p/d1789a6eb05fbeec915130232bf1e6c6.jpg,"[8943, 7811, 7824]",67.0,0.44,8943,7811,7824,phu_kien_thoi_trang
1421935813,"[Hcm]Korean Men's Trousers with Tapered Legs, High-End Office Form, 4-Way Stretch Fabric, No Ruffling",89000,4.7,240.0,Vietnam,No Brand,SHOP PHONG CÁCH MỚI  VONESA,https://vn-live-01.slatic.net/p/84fdd50deb3768ed1933285971bc4f41.jpg,"[62541004, 62540403, 7991]",1000.0,0.31,62541004,62540403,7991,thoi_trang_nam
2523750010,"(Free Ship) (Chính Hãng) Hộp 100v Uống Tăng Cân HAEMOVIT Plus Capsules Tăng Cân , tăng Cường Trao đổi Chất , Ăn Ngủ Ngon",96000,4.9,119.0,Vietnam,No Brand,Shop Xinh Xinh Chuyên Sỉ MP Chính Hãng,https://sg-test-11.slatic.net/p/a54644f8693b03611124da477de3cc8d.jpg,"[10100869, 4741, 6791, 2375]",456.0,0.2,10100869,4741,6791,thuc_pham
1894890004,"Bộ Mỹ Phẩm Gimi Luxury - Trắng da, Nám tàn nhang các Spa chuyên dùng",3350000,4.8,,Vietnam,No Brand,Sức khỏe và Sắc đẹp 86 0982691552,https://filebroker-cdn.lazada.vn/kf/Sf118f9f1916b47199900a2f5a7909902L.jpg,"[4405, 2277, 2288]",0.0,0.4,4405,2277,2288,my_pham
3197626287,JIFANPAUL | New Summer Fashionable Business Casual Lace-up Shoes White,207000,4.3,3.0,China,JIFANPAUL,JIFANPAUL Global,https://filebroker-cdn.lazada.vn/kf/S1fa51fa7461e430f8e793b1204b68b16W.jpg,"[62541201, 6371]",6.0,0.0,62541201,6371,0,thoi_trang_nam
3193870224,QIAOXIZI | Summer Lightweight Cotton Shorts for Women High Waist Slimming Casual Loose Mom's Style 7/8 Length,193000,4.8,82.0,China,QIAOXIZI,QXZ FASHION,https://filebroker-cdn.lazada.vn/kf/S670458bca51b4440b1da12c3f1d18e8c3.jpg,"[62540802, 11181, 11184]",20.0,0.7,62540802,11181,11184,thoi_trang_nu
3143606294,Lẻ 1 Gói ɡel POWER 1G kéo dài thời gian cho phái mạnh chính hãng,105000,5.0,8.0,Vietnam,No Brand,Fc0DinMp,https://vn-live-01.slatic.net/p/da05fea7cd1e3d568ac7bdce720d27dd.jpg,"[10100869, 4741, 6791, 2369]",61.0,0.0,10100869,4741,6791,thuc_pham
3062261191,"[Đáng Yêu & An Toàn] Xúc Xắc Âm Thanh Cho Bé - Hình Gấu, Hình Thỏ, Bo Tròn Chống Va Đập",177800,4.7,,Vietnam,No Brand,shop mecutit,https://sg-test-11.slatic.net/p/2f84684dd46f7e0e530c7227d5009160.jpg,"[10216, 10327, 10333]",0.0,0.3,10216,10327,10333,me_va_be
3284499984,Shock Absorption Racing Running Shoes With Carbon Plate,457000,4.8,9.0,China,No Brand,QingMa Shoes,https://filebroker-cdn.lazada.vn/kf/S7e67470e975443df97b56e74096b6e357.jpg,"[42062401, 7475, 7528]",31.0,0.0,42062401,7475,7528,the_thao
3229462753,"36-Month Warranty - 2L Electric Kettle - Boils Quickly, Automatically Shuts Off - Safe to Use - High-Quality Glass Electric Kettle",329000,5.0,11.0,Vietnam,No Brand,SUMSNAGEN,https://vn-live-01.slatic.net/p/9fa9de7efd8da4f53d1e0e81c7147701.jpg,"[4400, 4425, 6037, 4433]",14.0,0.5,4400,4425,6037,dien_tu
2415823462,"Đồ Chơi Máy Bay Trực Thăng Mini ,máy bay Điều Khiển Từ Xa . có cảm ứng va chạm Cho Trẻ Em",129000,4.7,,Vietnam,No Brand,mill,https://vn-live-01.slatic.net/p/481fffd0e7b3e920582123cab134082d.jpg,"[10216, 10223, 10268, 10504]",0.0,0.44,10216,10223,10268,me_va_be
2510830259,Chống Thấm Nước Cổ Điển Nam Unisex Tròn Chuyển Động Thạch Anh Hardlex Mặt Kính Dây Đeo Cao Su Màu Đen Thời Trang,14900,4.8,382.0,Vietnam,No Brand,APbc8I.Selection,https://vn-live-01.slatic.net/p/8643d8adf06ee41173ce10be62cfa89c.jpg,"[8943, 2765, 8945]",961.0,0.33,8943,2765,8945,thoi_trang_nam
1825705026,Ấm siêu tốc Thái Lan JIPLAI 2.5Lit JL-ST20 thiết kế 2 lớp chống bỏng khi sử dụng. BH 12 THÁNG TOÀN QUỐC,91640,5.0,3.0,Vietnam,No Brand,bambooshop2345,https://sg-live-01.slatic.net/p/7bc1e765051c5cf48712fe552209770b.png,"[4400, 4425, 6037, 4433]",7.0,0.42,4400,4425,6037,do_gia_dung
2976460072,3-layer multifunctional storage rack 4-tier trolley dedicated trolley for spa bathroom kitchen high-grade stainless steel warranty,19000,4.0,11.0,Vietnam,No Brand,Decor dễ dàng,https://vn-live-01.slatic.net/p/b1ba8d2b143331dc21500fc5b63e27a0.jpg,"[12648, 62551602, 12678, 12842]",90.0,0.24,12648,62551602,12678,do_gia_dung
3234243640,[Strongest Type] Box of 10 Rocket 1H Tablets - Helps Improve Men's Health - Lasts up to 60 Minutes,73000,4.0,5.0,Vietnam,No Brand,Mỹ Phẩm Luxury 123,https://vn-live-01.slatic.net/p/50d99053c004cea06485eefe4936b4fe.jpg,"[10100869, 4741, 6791, 2369]",42.0,0.5,10100869,4741,6791,thuc_pham
2733636068,"Cường lực dẻo Dành cho OPPO Reno 12F , Bảo vệ màng hình chống va đập trầy xước toàn diện.",22000,5.0,1.0,Vietnam,No Brand,AK-SKIN3,https://vn-live-01.slatic.net/p/fcd33c704621bb3ee021790f5f6f9130.jpg,"[42062201, 4522, 4528]",17.0,0.27,42062201,4522,4528,me_va_be
3040407747,JCAAAP Fashion Sun Protection Quick-Drying Sun Hat With Large Brim Shawl Fisherman Hat For Women,46418,4.9,66.0,China,JCAAAP,JCAAAP Vietnam,https://sg-test-11.slatic.net/p/8d570cd9925d1294254099bfafccbfce.jpg,"[8943, 7811, 7824]",228.0,0.44,8943,7811,7824,phu_kien_thoi_trang
2594476173,PKS Mắt kính thời trang Y2K Hiphop Sành điệu Hot Trend,25200,5.0,1.0,Vietnam,No Brand,PhuKien_SG,https://sg-test-11.slatic.net/p/1e38afc4f2cd8328ec751eb181a9b0f8.jpg,"[8943, 3504, 13326]",0.0,0.13,8943,3504,13326,phu_kien_thoi_trang
1951425814,Siêu điện đun nước siêu tốc 5L Fujika tự ngắt khi sôi hàng cty bảo hành 12 tháng,250000,4.6,14.0,Vietnam,No Brand,GIA DỤNG GIÁ RẺ 20,https://filebroker-cdn.lazada.vn/kf/S1a7110ad740744daa11d8ab4beb391541.jpg,"[4400, 4425, 6037, 4433]",52.0,0.31,4400,4425,6037,dien_tu
3070849198,THANKSKY khẩu trang kín mặt khau trang vải nữ khẩu trang chống uv Màu trơn Mặt nạ UV Chống nắng Nhanh khô Mặt nạ chống nắng lụa băng Ngầu Chống tia UV Khăn che mặt mỏng Phụ nữ,61700,4.9,,China,THANKSKY,THANKSKY SHOP,https://sg-test-11.slatic.net/p/dd2a5aed32d437b8c51665b3f5c246e7.jpg,"[8943, 7811, 7831]",7.0,0.49,8943,7811,7831,phu_kien_thoi_trang
13333853399,adidas | Adidas Superstar Ii - White Ji0080 2397219,3731400,4.8,,South Korea,adidas,The KoreaMart,https://filebroker-cdn.lazada.vn/kf/S27c18698dda444cdbd396ab8bfb65f61E.jpg,"[62188201, 1785, 62540406, 1786]",0.0,0.43,62188201,1785,62540406,the_thao
3231200953,adidas | Men's & Women's Breathable Running Shoes,2077000,4.8,,China,adidas,MY.JO sports shoes and clothing Specialty Store,https://filebroker-cdn.lazada.vn/kf/S5bd3f5db2857429f8329174400db7463a.jpg,"[42062401, 7473, 7491]",0.0,0.0,42062401,7473,7491,the_thao
2211921947,Jibbitz size lớn 5-7cm gắn dép sục Crocs,6000,4.9,,Vietnam,No Brand,4con6,https://vn-live-01.slatic.net/p/2caeafc3f5df49e7a47b4c2a4c5285de.jpg,"[62540402, 6246, 6248]",0.0,0.0,62540402,6246,6248,cham_soc_suc_khoe
13363672477,"Gói Chlorophyll Stick của Nature's Sunshine: Thơm ngát. Người hùng sức khỏe - Giải độc, Giảm đầy hơi, Làm sạch da, Hỗ trợ tiêu hóa, Tăng cường năng lượng chăm sóc sức khỏe",811461,4.9,,China,No Brand,5486fc0b,https://vn-live-01.slatic.net/p/f0f282d915c7f8121a5c1823dc87750e.jpg_webp,"[6524, 14236, 14295]",0.0,0.01,6524,14236,14295,cham_soc_suc_khoe
3230324507,"SET 6 CHARM STICKER GẮN DÉP CROSS, DÉP SỤC, DÉP XỐP",24000,4.9,,Vietnam,No Brand,Chic Charm - Charm Sticker Gắn Dép,https://sg-test-11.slatic.net/p/182be404bc013912acf918a3bda5e853.jpg,"[62540402, 6259]",0.0,0.0,62540402,6259,0,cham_soc_suc_khoe
3107786006,"Máy xay thịt đa năng Seka SK2287 dung tích 2L, 2 cối thủy tinh, xay thịt, xay tỏi ớt, rau củ...",342000,4.7,,Vietnam,No Brand,Siêu Thị Hàng Gia Dụng1609561128,https://vn-live-01.slatic.net/p/05599e746452004a5c17479e940d2a0c.jpg,"[4400, 4425, 6037, 4438]",0.0,0.12,4400,4425,6037,do_gia_dung
1114766999,Combo French Face Cream Chua a Cosmetic 20 Grams and Super Essence Serum Spot Esence 30ml Acosmetic - Phuong Anh Cosmetics,240000,5.0,195.0,Vietnam,ACOSMETICS,Thỏ Mặt Trời 1,https://filebroker-cdn.lazada.vn/kf/Sebee11a7bd084ca889fe62f58f0fcd57C.jpg,"[4405, 2277, 2283]",1300.0,0.27,4405,2277,2283,my_pham
3189066883,"Quần Jogger Nam Thể Thao Co Giãn – Dáng Xuông Phối Sọc Thời Trang, Mặc Cực Mát, có big size",85000,5.0,60.0,Vietnam,No Brand,Gấu.Store,https://vn-live-01.slatic.net/p/32b0ed1f82d4f36d918a62d5f48caf74.jpg,"[62541004, 62540403, 7991]",258.0,0.32,62541004,62540403,7991,thoi_trang_nam
3230512167,"Set 10 Charm Sticker Gắn Dép Cross, Dép Sục....",35000,4.5,2.0,Vietnam,No Brand,Chic Charm - Charm Sticker Gắn Dép,https://sg-test-11.slatic.net/p/01dfed118a68894fb431c5e4f1a2ffac.jpg,"[62540402, 6259]",0.0,0.0,62540402,6259,0,cham_soc_suc_khoe
2902088666,Áo Polo Cotton Tay ngắn có cổ thời trang mùa hè hàng mới trẻ trung,79000,4.7,124.0,Vietnam,No Brand,LONGTUYEN.068 Xưởng May Giá Sỉ ,https://sg-test-11.slatic.net/p/50171723136b5ae38ceaf502769152e4.jpg,"[62540802, 62541801, 10100799]",328.0,0.77,62540802,62541801,10100799,thoi_trang_nu
2934382398,set bộ tay ngắn quần kẻ thời trang siêu xinh,89000,4.9,265.0,Vietnam,No Brand,HUỲNH PHẠM SHOP,https://vn-live-01.slatic.net/p/f770b48b06a6c53e9d45948ecaeb1b5c.jpg,"[62540802, 42014401]",878.0,0.5,62540802,42014401,0,thoi_trang_nu
2982224361,"[CHÍNH HÃNG] Penirum A -  hỗ trợ mạnh gân cốt , tăng cường sinh lực (Hộp 30 viên)",495000,1.0,1.0,Vietnam,No Brand,SIÊU THỊ SỐNG KHỎE SG,https://vn-live-01.slatic.net/p/dbb428ebfd03ad4aa48ffd81a7d8ae67.png,"[10100869, 4741, 6791, 2369]",0.0,0.0,10100869,4741,6791,thuc_pham
2666686483,Sp Lifewise Junior 365 for Pregnant Women & Children Vitamin and Mineral Supplement Box of 60 Pills Genuine Products,520000,5.0,8.0,Vietnam,No Brand,Ngọc Nhi Thực phẩm chức năng ,https://filebroker-cdn.lazada.vn/kf/Se770220dcb2b48c8a2468729cb2ecade6.jpg,"[10100869, 4741, 6791, 2368]",54.0,0.31,10100869,4741,6791,thuc_pham
2940722052,🇻🇳Có Sẳn Hàng🇻🇳 Giày Thể Thao Nam Họa Tiết Camo Thời Trang,89000,4.0,3.0,Vietnam,No Brand,AAA.Giày,https://sg-test-11.slatic.net/p/74ce664c9fb4926ce339674433dfb6a4.jpg,"[62541201, 6371]",0.0,0.0,62541201,6371,0,thoi_trang_nam
3295502353,JIFANPAUL | Thick Windproof Warmth Neck Warmer for Children,128000,4.2,4.0,China,JIFANPAUL,JIFANPAUL Global,https://filebroker-cdn.lazada.vn/kf/S024a8918911b409d90394c46cc810303p.jpg,"[62188201, 62541009, 62544801, 1720]",0.0,0.26,62188201,62541009,62544801,phu_kien_thoi_trang
3272003003,Induction Cookers Are on Clearance.,215008,4.7,,Vietnam,No Brand,DientuTranThan ,https://filebroker-cdn.lazada.vn/kf/S4fec27040cc547cab1de3ebabb48be8eN.jpg,"[4400, 4425, 62551606, 12634]",0.0,0.0,4400,4425,62551606,dien_tu
13326441856,Elegant Women's Khaki Pants from Beautiful and Cool Are Beautiful and Cool.,169000,5.0,7.0,Vietnam,ROSACA, Kim Liên KT 89,https://vn-live-01.slatic.net/p/c9d091de2f56d6ae739626fbc80a0e7a.png,"[62540802, 62541005, 7954]",14.0,0.21,62540802,62541005,7954,thoi_trang_nu
1009276736,Steamed Squid with Delicious Coconut Water Tps Snacks,99000,4.6,355.0,Vietnam,No Brand,THỰC PHẨM SẠCH 3 MIỀN - ĐỒ ĂN VẶT,https://vn-live-01.slatic.net/p/6aa9b2e0e5a18c11992972639d589246.jpg,"[8799, 10003011, 10003060, 10003303]",1300.0,0.34,8799,10003011,10003060,thuc_pham
368186976,MẮT KÍNH CAO CẤP -  MẮT KÍNH NỮ ỐC GỌNG ĐÁ XOÀN CAO CẤP 171,79000,4.9,1155.0,Vietnam,No Brand,Nhà Bự Chuyên sỉ,https://filebroker-cdn.lazada.vn/kf/Sa4b86349f815440994a6180196b9ac95N.jpg,"[8943, 3504, 13326]",5000.0,0.47,8943,3504,13326,phu_kien_thoi_trang
3064522427,"Mắt Kính Thời Trang Nam Nữ  Porche P8000 Chống Tia Cực Tím , Kính Mát Phân Cực Polarizer Porche Chống Tia Cực Tím Thời Trang Sành Điệu Chống Chói, Chống Tia UV Và Tia Tử Ngoại Giúp Bảo Vệ Đôi Mắt.",140000,5.0,11.0,Vietnam,BASEUS,Baseus Mall,https://vn-live-01.slatic.net/p/2f5969110beeedb9f68bb38533a4d6e9.jpg,"[8943, 3504, 13326]",13.0,0.5,8943,3504,13326,phu_kien_thoi_trang
13333529838,adidas | Adidas Baby Sneakers Superstar 36 Daily Lightweight Comfortable Fashion Sneakers,1256750,4.8,,South Korea,adidas,The KoreaMart,https://filebroker-cdn.lazada.vn/kf/Saf7e11bc50184c40b5bc2af998bdef1aH.jpg,"[62188201, 1785, 62540406, 1786]",0.0,0.59,62188201,1785,62540406,the_thao
13336784480,Ultra-light CNC Machined 12 Speed MS Compatible Cogset,3835000,4.8,,China,No Brand,Left Bank Bikes,https://filebroker-cdn.lazada.vn/kf/Sb9b82e61da6b46af9e6ead517ade12ecj.jpg,"[1355, 6593, 1596, 1600, 1604]",0.0,0.0,1355,6593,1596,the_thao
2509281772,"Quần Jean Nữ Skinny Co Giãn – Wash Nhẹ. Thời Trang, Ôm Dáng, Nhiều Màu, Size 40–60kg",13900,4.8,1446.0,Vietnam,No Brand,d3odSmYq.Selection,https://vn-live-01.slatic.net/p/332fb64a5ae9b68df6f6f66e4cc1f126.jpg,"[62540802, 62541801, 6399]",4100.0,0.33,62540802,62541801,6399,thoi_trang_nu
13365288548,FULL100 20x200cm Tấm bảo vệ chống va chạm Bọt mềm Tự dính Đệm gói mềm Đệm chống va chạm Bọt dày Tem nhãn chống va chạm An toàn cho trẻ em,223000,4.7,,China,No Brand,Full100,https://sg-test-11.slatic.net/p/33763866d6b4d969a4f22a573ffd82c7.png,"[12645, 12652, 62553203, 12724]",0.0,0.41,12645,12652,62553203,me_va_be
2650344292,Ấm siêu tốc Electric Kettle Inox 1.8L - Bình đun siêu tốc cao cấp bảo hành 12 tháng.,89000,5.0,3.0,Vietnam,No Brand,Bon an gia dụng,https://sg-test-11.slatic.net/p/0c38bfad6184aacd13e6d25f06ecc1d8.jpg,"[4400, 4425, 6037, 4433]",10.0,0.44,4400,4425,6037,dien_tu
2892625577,Ins Cute Hello Kitty Crocs Charm Jibbitz Clog Jibbitz Set Crocs Cute DIY Accessories KT Cat,108785,5.0,9.0,China,OEM,sotta.vn,https://sg-test-11.slatic.net/p/c3c04ff6f76739723023528124063ebd.jpg,"[62540402, 6259]",0.0,0.47,62540402,6259,0,cham_soc_suc_khoe
13363282766,"Gói Chlorophyll Stick của Nature's Sunshine: Thơm ngát. Người hùng sức khỏe - Giải độc, Giảm đầy hơi, Làm sạch da, Hỗ trợ tiêu hóa, Tăng cường năng lượng chăm sóc sức khỏe",811186,4.9,,China,No Brand,f94ad745,https://vn-live-01.slatic.net/p/f0f282d915c7f8121a5c1823dc87750e.jpg_webp,"[6524, 14236, 14295]",0.0,0.01,6524,14236,14295,cham_soc_suc_khoe
3039815686,VINTLOOK Men's Socks Thick Towel Bottom Mid-Length High-Top Running Sports Socks,11000,4.9,451.0,China,VINTLOOK,VINTLOOK MALL,https://sg-test-11.slatic.net/p/31f3734348a2cdb9872813230d8956f7.jpg,"[42062401, 13153, 13232]",3200.0,0.45,42062401,13153,13232,thoi_trang_nam
3035131487,"Ấm đun nước siêu tốc GD - ST21, Kiêm bình giữ nhiệt 24H, Dung tích 3L công suất 1500W, Bảo Hành 12 Tháng",139000,4.9,35.0,Vietnam,OEM,BOSS BIG SHOP,https://sg-test-11.slatic.net/p/c40ed5b37d54b5aacbf41dbaf75cc8bc.jpg,"[12648, 62551602, 12670, 12775]",113.0,0.3,12648,62551602,12670,do_gia_dung
2424423342,TWEEN 80 1 kg,256500,4.8,,Vietnam,No Brand,Đế Doanh Chính,https://sg-test-11.slatic.net/p/096b81f05b79ca9af6803ca2201dbaaf.jpg,"[10100869, 4741, 6782, 2374]",0.0,0.05,10100869,4741,6782,thuc_pham
3057432595,"Jibbitz charm kim loại 3D cao cấp gắn dép sục, sticker gắn dép cá sấu ngọc trai, kim cương, jibbitz lấp lánh",25000,4.9,,Vietnam,No Brand,Nhà Cá Sấu,https://sg-test-11.slatic.net/p/3962acf837c263f628d974211b88cfab.jpg,"[62540402, 6259]",0.0,0.0,62540402,6259,0,cham_soc_suc_khoe
2417303043,"Ghế Ngồi Xe Máy Cho Bé Ngồi Trước Xe Ga, Xe Điện Chở Bé Đi An Toàn Phù Hợp Vision, SH, Lead, Vespa Chống Rung Va Đập",499000,5.0,9.0,Vietnam,No Brand,BABY_MALL,https://vn-live-01.slatic.net/p/f32d55438dfa26d89a8a26d604b6cff4.jpg,"[1355, 6593, 1596, 1599, 7059]",81.0,0.17,1355,6593,1596,me_va_be
1959359509,[FreeshipMAX] Ấm Đun Nước Siêu Tốc Thái Lan Jiplai 2 Lớp Dung Tích 2.5 Lít Chống Nóng,105000,4.0,4.0,Vietnam,No Brand,Gia Dụng THUONGHUONG,https://vn-live-01.slatic.net/p/4ce3a2e7eae6e9487c749374406f10c0.jpg,"[4400, 4425, 6037, 4433]",19.0,0.16,4400,4425,6037,dien_tu
3315062180,"Ghế Ô Tô Cho Bé Bản Cao Cấp SIP - Bảo Vệ Đa Điểm, Chống Va Đập Cạnh Bên (9 Tháng - 12 Tuổi) ⚜️Home and Garden⚜️",3185000,4.7,,Vietnam,No Brand,Home and Garden,https://sg-test-11.slatic.net/p/8af45c8e05122c2ccc707549dece705a.jpg,"[10550, 10731, 10732, 10734]",0.0,0.0,10550,10731,10732,me_va_be
2854913374,Dán chống nhìn trộm dẻo nano cho Samsung M05 - chống va đập tốt,63000,4.7,,Vietnam,No Brand,Của Hàng Phụ Kiện Hảo Mobile,https://sg-test-11.slatic.net/p/7dbaa7384177c9890d6a28abcc4bf122.jpg,"[42062201, 4522, 4528]",0.0,0.1,42062201,4522,4528,me_va_be
2704225380,"Bộ 14 Jibbitz, Sticker, Charm 3D chủ đề CÔ GÁI,THÁP PARIS...nhựa cứng 3D mạ kim gắn Dép Crocs,Dép Sục - ĐÃ SẴN NÚT CHỐT",65000,5.0,2.0,Vietnam,No Brand,TAHOGANO,https://sg-test-11.slatic.net/p/727bdfaac1b36bc609cd3af63890e570.jpg,"[62540402, 6259]",7.0,0.35,62540402,6259,0,cham_soc_suc_khoe
3307007655,[New]Flower Knows Bunny Garden Collection Embossed Blush Gentle Blush in Spring and Summer Tones Cosmetics New Products,475640,4.8,21.0,China,Flower Knows,FlowerKnows,https://vn-live-01.slatic.net/p/e72f8b48d7a9868c5482d487cb7e39f7.jpg,"[4405, 4611, 4612, 4630]",122.0,0.37,4405,4611,4612,my_pham
2037160319,Set of White Cotton Gloves and Foot Covers for Newborn Babies - Hotga,17500,4.9,,Vietnam,hotga,MEYEUCON-2015,https://vn-live-01.slatic.net/p/0d45cb51a369b97d2ef604ae800a70ae.png,"[62188201, 62541009, 62544801, 1720]",0.0,0.3,62188201,62541009,62544801,phu_kien_thoi_trang
2147699160,[Chính Hãng] Bình đun siêu tốc chuẩn inox Sunhouse 1.8 lít SHD1182,190000,4.7,,Vietnam,Sunhouse,Kho Gia Dụng Chiếu Sáng An Tâm ,https://vn-live-01.slatic.net/p/8a286a47f91bc9933f87eaec5c1d99ff.jpg,"[4400, 4425, 6037, 4433]",0.0,0.34,4400,4425,6037,dien_tu
